{"change_notes":[{"kind":"initial","revision":1}],"constraints":[],"contract":"intentline.acceptance","contract_id":"frozen-03","evidence_gaps":[],"intended_outcome":"Reject empty and whitespace-only usernames","open_decisions":[],"out_of_scope":[],"requirements":[{"basis":"request","boundaries":["empty","spaces","tabs"],"id":"R1","oracle":"Validation error for empty or whitespace-only input","plan_state":"planned","planned_evidence":"Observe public validation with empty, spaces and tabs","seam":"Public validation interface","source_refs":[{"line_end":1,"line_start":1,"quote":"Reject empty and whitespace-only usernames","source_id":"S1"}],"statement":"Reject empty and whitespace-only usernames"}],"revision":1,"schema_version":1,"source_bundle_sha256":"386ec251312d24ea153e3106fcfa9651dc33bfa1c2ea08332162a1ade8ed13d3"}
