{"change_notes":[{"kind":"initial","revision":1}],"constraints":[],"contract":"intentline.acceptance","contract_id":"portable-input-boundary","evidence_gaps":[],"intended_outcome":"Portable source-preserving export and separately authorized consumer admission","open_decisions":[],"out_of_scope":[],"requirements":[{"basis":"request","boundaries":["Authorization is not established by export","Source and complete parent remain authoritative"],"id":"R1","oracle":"Source chain preserved without implied authorization","plan_state":"planned","planned_evidence":"Offline positive and negative consumer observation","seam":"Portable exporter","source_refs":[{"line_end":1,"line_start":1,"quote":"1. Add `export --format proofline-native`; preserve existing `proofline-direct`, `markdown`, and `json` byte/behavior contracts. Native export is a **candidate input bundle**, not authorization or proof. It may be inspected while unapproved, but its manifest must explicitly say `authorization: not_established`; only a separately trusted caller can authorize native delivery. The manifest contains contract JSON, exact original request and every amendment byte stream, all binding context, source/contract/successor/continuity identities, current requirements and constraints, open decisions/evidence gaps, advisory audit and adoption provenance, and a hash for every included file. A complete marker is written last.","source_id":"S1"}],"statement":"1. Add `export --format proofline-native`; preserve existing `proofline-direct`, `markdown`, and `json` byte/behavior contracts. Native export is a **candidate input bundle**, not authorization or proof. It may be inspected while unapproved, but its manifest must explicitly say `authorization: not_established`; only a separately trusted caller can authorize native delivery. The manifest contains contract JSON, exact original request and every amendment byte stream, all binding context, source/contract/successor/continuity identities, current requirements and constraints, open decisions/evidence gaps, advisory audit and adoption provenance, and a hash for every included file. A complete marker is written last."},{"basis":"request","boundaries":["Authorization is not established by export","Source and complete parent remain authoritative"],"id":"R2","oracle":"Missing exact adoption refuses before dispatch","plan_state":"planned","planned_evidence":"Offline positive and negative consumer observation","seam":"Trusted-caller consumer admission","source_refs":[{"line_end":2,"line_start":2,"quote":"3. Require **Proofline's own trusted-caller exact adoption** of contract **and** complete source chain, with a genuine externally inspected authorization reference. An Intentline `ADOPTED_ASSERTED` assertion, self-produced JSON file, `approved` label, or digest alone never suffices. Use separate explicit flags for native adoption as appropriate, preserving current source/contract hash semantics. Retain the actual inspection reference in host-protected receipts and do not leak potentially sensitive approval payload to workers.","source_id":"S1"}],"statement":"3. Require **Proofline's own trusted-caller exact adoption** of contract **and** complete source chain, with a genuine externally inspected authorization reference. An Intentline `ADOPTED_ASSERTED` assertion, self-produced JSON file, `approved` label, or digest alone never suffices. Use separate explicit flags for native adoption as appropriate, preserving current source/contract hash semantics. Retain the actual inspection reference in host-protected receipts and do not leak potentially sensitive approval payload to workers."}],"revision":1,"schema_version":1,"source_bundle_sha256":"SOURCE_BUNDLE_AT_PREPARE"}
