{"change_notes":[{"kind":"initial","revision":1}],"constraints":[],"contract":"intentline.acceptance","contract_id":"username-validation-host-successor","evidence_gaps":[],"intended_outcome":"Empty and whitespace-only usernames receive a validation error","open_decisions":[],"out_of_scope":[],"requirements":[{"basis":"request","boundaries":["normal input","representative falsifying input"],"id":"R1","oracle":"Empty and whitespace-only usernames receive a validation error","plan_state":"planned","planned_evidence":"Observe the public requested outcome against source-derived expectations","seam":"public requested interface","source_refs":[{"line_end":1,"line_start":1,"quote":"Reject empty and whitespace-only usernames","source_id":"S1"}],"statement":"Empty and whitespace-only usernames receive a validation error"},{"basis":"request","boundaries":["32 characters remain in the original valid input domain","33 characters"],"id":"R2","oracle":"Validation error for a 33-character username; no new rejection for an otherwise valid 32-character username","plan_state":"planned","planned_evidence":"Call the public validation seam with independent 32/33-character cases","seam":"public requested interface","source_refs":[{"line_end":1,"line_start":1,"quote":"Reject usernames longer than 32 characters","source_id":"S2"}],"statement":"Reject usernames longer than 32 characters"}],"revision":1,"schema_version":1,"source_bundle_sha256":"6a28ccbf853807ddbc5971d18596c6a4b699fee54aeecb2a24ce0f140d9d3d47"}
