{
  "contract": "intentline.acceptance",
  "schema_version": 1,
  "contract_id": "username-validation",
  "revision": 1,
  "source_bundle_sha256": "SOURCE_BUNDLE_AT_PREPARE",
  "intended_outcome": "Empty and whitespace-only usernames receive a validation error",
  "requirements": [
    {
      "id": "R1",
      "statement": "Empty and whitespace-only usernames receive a validation error",
      "basis": "request",
      "source_refs": [
        {
          "source_id": "S1",
          "line_start": 1,
          "line_end": 1,
          "quote": "Reject empty and whitespace-only usernames"
        }
      ],
      "boundaries": [
        "normal input",
        "representative falsifying input"
      ],
      "seam": "public requested interface",
      "oracle": "Empty and whitespace-only usernames receive a validation error",
      "planned_evidence": "Observe the public requested outcome against source-derived expectations",
      "plan_state": "planned"
    }
  ],
  "constraints": [],
  "out_of_scope": [],
  "open_decisions": [],
  "evidence_gaps": [],
  "change_notes": [
    {
      "revision": 1,
      "kind": "initial"
    }
  ]
}
