{"change_notes":[{"kind":"initial","revision":1}],"constraints":[],"contract":"intentline.acceptance","contract_id":"username-validation","evidence_gaps":[],"intended_outcome":"Reject empty and whitespace-only usernames","open_decisions":[],"out_of_scope":[],"requirements":[{"basis":"request","boundaries":["empty","spaces","tabs"],"id":"R1","oracle":"validation error for empty/whitespace-only usernames","plan_state":"planned","planned_evidence":"call interface with empty, spaces, and tabs","seam":"public validation interface","source_refs":[{"line_end":1,"line_start":1,"quote":"Reject empty and whitespace-only usernames","source_id":"S1"}],"statement":"Reject empty and whitespace-only usernames"}],"revision":1,"schema_version":1,"source_bundle_sha256":"8e9119d2927e2e5114e9d1a9c1196b2b8cdad6b36a38fe7153f96112a3a1ecdb"}
