{"change_notes":[{"kind":"initial","revision":1}],"constraints":[],"contract":"intentline.acceptance","contract_id":"username-validation","evidence_gaps":[],"intended_outcome":"Empty and whitespace-only usernames receive a validation error","open_decisions":[],"out_of_scope":[],"requirements":[{"basis":"request","boundaries":["normal input","representative falsifying input"],"id":"R1","oracle":"Empty and whitespace-only usernames receive a validation error","plan_state":"planned","planned_evidence":"Observe the public requested outcome against source-derived expectations","seam":"public requested interface","source_refs":[{"line_end":1,"line_start":1,"quote":"Reject empty and whitespace-only usernames","source_id":"S1"}],"statement":"Empty and whitespace-only usernames receive a validation error"}],"revision":1,"schema_version":1,"source_bundle_sha256":"d1912c64f2aab0cc80e202a345c06559626aabde5eef3b5fd0c311e25800e25d"}
