[{"change_notes":[{"kind":"initial","revision":1}],"constraints":[{"basis":"request","scope":"Every child","source_refs":[{"line_end":2,"line_start":2,"quote":"Keep valid usernames unchanged","source_id":"S1"}],"statement":"Preserve valid usernames"}],"contract":"intentline.acceptance","contract_id":"username-validation","evidence_gaps":[],"intended_outcome":"Reject empty and whitespace-only usernames","open_decisions":[],"out_of_scope":[{"source_refs":[{"line_end":2,"line_start":2,"quote":"Keep valid usernames unchanged","source_id":"S1"}],"statement":"No other changes to valid usernames"}],"requirements":[{"basis":"request","boundaries":["empty","spaces","tabs"],"id":"R1","oracle":"validation error for empty/whitespace-only usernames","plan_state":"planned","planned_evidence":"call interface with empty, spaces, and tabs","seam":"public validation interface","source_refs":[{"line_end":1,"line_start":1,"quote":"Reject empty and whitespace-only usernames","source_id":"S1"}],"statement":"Reject empty and whitespace-only usernames"},{"basis":"request","boundaries":["valid username"],"id":"R2","oracle":"Exact valid username retained","plan_state":"planned","planned_evidence":"Observe public validation with a valid username","seam":"public validation interface","source_refs":[{"line_end":2,"line_start":2,"quote":"Keep valid usernames unchanged","source_id":"S1"}],"statement":"Keep valid usernames unchanged"}],"revision":1,"schema_version":1,"source_bundle_sha256":"15df00ccc974cf497ccf4ca74c4166972c39d45033be089387fecc6f0a262c9a"}]
